{
  "$schema": "https://json-schema.org/draft/2020-12/schema",
  "$defs": {
    "EndpointDesc": {
      "oneOf": [
        {
          "properties": {
            "ip_address": {
              "type": "string"
            },
            "port": {
              "type": "integer"
            },
            "protocol": {
              "type": "string"
            },
            "is_stun_discovered": {
              "type": "boolean"
            }
          },
          "additionalProperties": false,
          "type": "object",
          "required": [
            "ip_address",
            "port"
          ]
        },
        {
          "type": "string"
        }
      ]
    },
    "NativeTelemetry": {
      "properties": {
        "version": {
          "type": "integer"
        },
        "session_id": {
          "type": "string"
        },
        "sequence": {
          "type": "string"
        },
        "counter_epoch": {
          "type": "string"
        },
        "source": {
          "type": "string"
        },
        "traffic_available": {
          "type": "boolean"
        },
        "rx_bytes": {
          "type": "string"
        },
        "tx_bytes": {
          "type": "string"
        },
        "memory_runtime_sys_bytes": {
          "type": "string"
        }
      },
      "additionalProperties": false,
      "type": "object",
      "required": [
        "version",
        "session_id",
        "sequence",
        "counter_epoch",
        "source",
        "traffic_available",
        "memory_runtime_sys_bytes"
      ]
    },
    "PeerAttestation": {
      "properties": {
        "node_id": {
          "type": "string"
        },
        "os_name": {
          "type": "string"
        },
        "os_version": {
          "type": "string"
        },
        "client_version": {
          "type": "string"
        },
        "country_code": {
          "type": "string"
        },
        "asn": {
          "type": "integer"
        },
        "disk_encrypted": {
          "oneOf": [
            {
              "type": "boolean"
            },
            {
              "type": "null"
            }
          ]
        },
        "firewall_active": {
          "oneOf": [
            {
              "type": "boolean"
            },
            {
              "type": "null"
            }
          ]
        },
        "is_rootless": {
          "type": "boolean"
        },
        "timestamp_utc": {
          "type": "string",
          "format": "date-time"
        }
      },
      "additionalProperties": false,
      "type": "object",
      "required": [
        "node_id",
        "os_name",
        "os_version",
        "client_version",
        "country_code",
        "asn",
        "disk_encrypted",
        "firewall_active",
        "is_rootless",
        "timestamp_utc"
      ]
    }
  },
  "$comment": "DO NOT EDIT. Generated by 'go run ./cmd/contractgen' from Go struct tags in pkg/control/types.go.",
  "properties": {
    "telemetry": {
      "$ref": "#/$defs/NativeTelemetry"
    },
    "node_id": {
      "type": "string"
    },
    "sequence_num": {
      "type": "integer"
    },
    "endpoints": {
      "items": {
        "$ref": "#/$defs/EndpointDesc"
      },
      "type": "array"
    },
    "active_circuits": {
      "type": "integer"
    },
    "tx_bytes_sec": {
      "type": "integer"
    },
    "rx_bytes_sec": {
      "type": "integer"
    },
    "cpu_usage_pct": {
      "type": "integer"
    },
    "memory_usage_mb": {
      "type": "integer"
    },
    "battery_level_pct": {
      "type": "integer"
    },
    "on_battery_power": {
      "type": "boolean"
    },
    "rtt_ms": {
      "type": "integer"
    },
    "posture": {
      "$ref": "#/$defs/PeerAttestation"
    }
  },
  "additionalProperties": false,
  "type": "object",
  "required": [
    "node_id"
  ]
}
